{
  "skill": "pdf-accessibility",
  "scope": [
    "docs/annual-report.pdf"
  ],
  "findings": [
    {
      "rule": "PDFUA.01.001",
      "wcag": "1.3.1 A",
      "severity": "critical",
      "confidence": "high",
      "location": "docs/annual-report.pdf, page 1",
      "summary": "Document is untagged, so it has no reading order.",
      "fix": "Tag the document, then correct the reading order in the Tags panel or rebuild it from a tagged source."
    }
  ],
  "passed": [
    "Document language is set"
  ],
  "notes": [
    "Table structure cannot be judged until the document is tagged."
  ]
}
