{
  "skill": "tables-data-specialist",
  "scope": [
    "src/components/PricingTable.tsx"
  ],
  "findings": [
    {
      "rule": "TABLE-001",
      "wcag": "1.3.1 A",
      "severity": "serious",
      "confidence": "high",
      "location": "src/components/PricingTable.tsx:18",
      "summary": "Data table has no header cells.",
      "fix": "Use th with scope=\"col\" for the plan row and scope=\"row\" for each feature name.",
      "component": "PricingTable"
    }
  ],
  "passed": [
    "Table has a caption"
  ]
}
