{
  "skill": "alt-text-headings",
  "scope": [
    "src/pages/index.tsx"
  ],
  "findings": [
    {
      "rule": "IMG-001",
      "wcag": "1.1.1 A",
      "severity": "critical",
      "confidence": "high",
      "location": "src/pages/index.tsx:23",
      "summary": "Hero image carries no alt attribute.",
      "fix": "Add alt text describing what the image conveys, or alt=\"\" if it is decorative."
    },
    {
      "rule": "HEAD-002",
      "wcag": "1.3.1 A",
      "severity": "moderate",
      "confidence": "high",
      "location": "src/pages/index.tsx:61",
      "summary": "Heading level jumps from h2 to h4.",
      "fix": "Change the h4 to h3, or add the missing h3 section it belongs under."
    }
  ],
  "passed": [
    "Exactly one h1 on the page",
    "Every decorative icon is aria-hidden"
  ]
}
