{
  "skill": "aria-specialist",
  "scope": [
    "src/components/Tabs.tsx"
  ],
  "findings": [
    {
      "rule": "ARIA-011",
      "wcag": "4.1.2 A",
      "severity": "serious",
      "confidence": "high",
      "location": "src/components/Tabs.tsx:31",
      "summary": "Tab list is built from div elements with no roles.",
      "fix": "Add role=\"tablist\" to the container, role=\"tab\" to each control, role=\"tabpanel\" to each panel, and wire aria-controls and aria-selected.",
      "evidence": "<div class=\"tabs\"><div class=\"tab is-active\">Overview</div></div>",
      "component": "Tabs"
    },
    {
      "rule": "ARIA-003",
      "wcag": "1.3.1 A",
      "severity": "minor",
      "confidence": "medium",
      "location": "src/components/Card.tsx:12",
      "summary": "Redundant role on a semantic element.",
      "fix": "Remove role=\"article\" from the article element; the element already carries that role."
    },
    {
      "rule": "ARIA-012",
      "wcag": "1.3.1 A",
      "severity": "moderate",
      "confidence": "medium",
      "location": "src/components/MessageHeader.tsx:8",
      "summary": "A flex row splits one phrase (author and timestamp) into two accessibility objects, so VoiceOver takes two swipes for one line.",
      "fix": "Wrap the author and timestamp in a single inline span and make that the one flex child, or add a real separator character between them in a non-hidden span.",
      "evidence": "<div class=\"msg-header\"><span>Ada</span><span>6:37 PM</span></div>",
      "component": "MessageHeader"
    }
  ],
  "passed": [
    "No aria-hidden on a focusable element",
    "No abstract roles used"
  ],
  "notes": [
    "Whether the tab panel updates on arrow keys needs a runtime check."
  ]
}
